{
  "schema_version": "1.0.0",
  "clip_id": "practice_02",
  "annotator": "main",
  "created_at": "2026-10-10T16:06:06.854Z",
  "events": [
    {
      "id": 1,
      "type": "delivery",
      "start_s": 0,
      "end_s": 0.03,
      "confidence": "high",
      "bowler_type": "pace",
      "length": "good",
      "outcome": "dot"
    },
    {
      "id": 2,
      "type": "shot",
      "start_s": 0.03,
      "end_s": 0.05,
      "confidence": "high",
      "shot_type": "leave",
      "contact": "missed"
    }
  ]
}
