{
  "schema_version": "1.0.0",
  "clip_id": "practice_04",
  "annotator": "main",
  "created_at": "2026-10-10T16:18:52.970Z",
  "events": [
    {
      "id": 1,
      "type": "delivery",
      "start_s": 0,
      "end_s": 0.02,
      "confidence": "high",
      "bowler_type": "spin",
      "length": "full",
      "outcome": "boundary"
    },
    {
      "id": 2,
      "type": "shot",
      "start_s": 0.02,
      "end_s": 0.03,
      "confidence": "high",
      "shot_type": "slog",
      "contact": "middled"
    },
    {
      "id": 3,
      "type": "boundary",
      "start_s": 0.04,
      "end_s": 0.05,
      "confidence": "high",
      "runs": 4
    }
  ]
}
