{
  "schema_version": "1.0.0",
  "clip_id": "match_01",
  "annotator": "1",
  "created_at": "2026-10-11T15:42:23.961Z",
  "events": [
    {
      "id": 1,
      "type": "shot",
      "start_s": 0.04,
      "end_s": 0.05,
      "confidence": "high",
      "shot_type": "flick",
      "contact": "edged"
    }
  ]
}
