{
  "schema_version": "1.0.0",
  "clip_id": "match_01",
  "annotator": "main",
  "created_at": "2026-10-11T15:42:03.399Z",
  "events": [
    {
      "id": 1,
      "type": "delivery",
      "start_s": 0,
      "end_s": 0.04,
      "confidence": "high",
      "bowler_type": "pace",
      "length": "full",
      "outcome": "runs"
    },
    {
      "id": 2,
      "type": "shot",
      "start_s": 0.05,
      "end_s": 0.06,
      "confidence": "high",
      "shot_type": "other",
      "contact": "edged"
    }
  ]
}
