{
  "schema_version": "1.0.0",
  "clip_id": "example_clip",
  "annotator": "main",
  "created_at": "2026-10-07T06:07:13.151Z",
  "events": [
    {
      "id": 1,
      "type": "delivery",
      "start_s": 5,
      "end_s": 10,
      "confidence": "high",
      "bowler_type": "pace",
      "length": "good",
      "outcome": "boundary"
    },
    {
      "id": 2,
      "type": "boundary",
      "start_s": 7,
      "end_s": 8,
      "confidence": "high",
      "runs": 4
    }
  ]
}