{
  "schema_version": "1.0.0",
  "clip_id": "practice_03",
  "annotator": "main",
  "created_at": "2026-10-10T16:16:33.841Z",
  "events": [
    {
      "id": 1,
      "type": "delivery",
      "start_s": 0,
      "end_s": 0.02,
      "confidence": "high",
      "bowler_type": "spin",
      "length": "full",
      "outcome": "runs"
    },
    {
      "id": 2,
      "type": "shot",
      "start_s": 0.03,
      "end_s": 0.05,
      "confidence": "high",
      "shot_type": "sweep",
      "contact": "middled"
    }
  ]
}
