{
  "schema_version": "1.0.0",
  "clip_id": "net_session_01",
  "annotator": "main",
  "created_at": "2026-10-07T19:08:21.583Z",
  "events": [
    {
      "id": 1,
      "type": "shot",
      "start_s": 0.03,
      "end_s": 0.05,
      "confidence": "high",
      "shot_type": "slog",
      "contact": "middled"
    }
  ]
}
