{
  "schema_version": "1.0.0",
  "clip_id": "practice_01",
  "annotator": "1",
  "created_at": "2026-10-10T16:02:47.187Z",
  "events": [
    {
      "id": 1,
      "type": "shot",
      "start_s": 0.02,
      "end_s": 0.03,
      "confidence": "high",
      "shot_type": "pull",
      "contact": "middled"
    }
  ]
}
